{
  "schema_version": "1.0.0",
  "risk_id": "RISK-002",
  "title": "Audit evidence backlog could delay SOC 2 readiness",
  "status": "open",
  "owner": {
    "team": "GRC"
  },
  "treatment": "monitor",
  "inherent": {
    "likelihood": 3,
    "impact": 4
  },
  "linked_findings": [
    "soc2-gap-2026-w16"
  ],
  "created_at": "2026-04-10T09:15:00Z",
  "updated_at": "2026-04-17T16:45:00Z"
}
